ID,Date,Formatted_Date,Title,Outlet,Category,Original_Claim,Correction,Link,Source,Views_Estimate
6a96cb774c28,2026-06-19,"Jun 19, 2026",CORRECTION - CCC Signs MoU to Expand Canadian Defence Trade with the Dominican Republic,GlobeNewswire,National,Original story referenced in the retraction (see full article),"OTTAWA, Ontario, June 19, 2026 (GLOBE NEWSWIRE) -- In a release issued under the same headline earlier today by Canadian Commercial Corporation, it stated in the third paragraph that the MoU was signed on May 25, 2026, instead of June 12, 2026. The corrected …",https://www.globenewswire.com/news-release/2026/06/19/3314803/0/en/CORRECTION-CCC-Signs-MoU-to-Expand-Canadian-Defence-Trade-with-the-Dominican-Republic.html,NewsAPI Auto,
5a348042b705,2026-06-19,"Jun 19, 2026",German Ambassador clarifies position on PMO visit amid passport contract controversy,Khabarhub.com,Global/International,Original story referenced in the retraction (see full article),KATHMANDU: German Ambassador to Nepal Udo Volz has issued a public clarification regarding media reports surrounding his recent visit to the Prime Minister’s Office (PMO) in connection with the passport printing contract controversy. In a statement posted on …,https://english.khabarhub.com/2026/19/554676/,NewsAPI Auto,
4a3e518dc803,2026-06-19,"Jun 19, 2026",Doctorâs COVID-19 Study Retracted Amid Questions Over Pharma Investor Ties,Naturalnews.com,Global/International,Original story referenced in the retraction (see full article),"The retraction of a clinical trial by Dr. Sabine Hazan exploring treatments for COVID-19 has raised renewed questions about undisclosed ties between researchers and pharmaceutical investors. The studies, which had been published in peer-reviewed journals, wer…",https://www.naturalnews.com/2026-06-19-doctor-covid-study-retracted-over-pharma-ties.html,NewsAPI Auto,
c00937423c0d,2026-06-18,"Jun 18, 2026",Kyle Cooke Clarifies ‘Summer House’ “Isn’t Cancelled” & “This Is Not Me Announcing I Won’t Return” Following Emotional Message,Deadline,National,Original story referenced in the retraction (see full article),"Kyle Cooke of Bravo’s Summer House had many people thinking he had quit the show after 10 seasons. However, in an edit to his original social media post, the DJ and entrepreneur is explaining that the show is not canceled. “End of Season 10 and a decade of fi…",http://deadline.com/2026/06/kyle-cooke-summer-house-emotional-message-1236962227/,NewsAPI Auto,
5ac390b8ab81,2026-06-18,"Jun 18, 2026",RFK Jr. has various stances on retractions. Critics say he’s ‘politicizing’ them,Retractionwatch.com,Global/International,Original story referenced in the retraction (see full article),"Robert F. Kennedy Jr.’s letter demanding answers from a journal that recently retracted an article about vaccines has drawn significant attention. But the inquiry isn’t the first time Kennedy has used his platform to try to influence retraction decisions, wit…",https://retractionwatch.com/2026/06/18/rfk-jr-vaccines-infant-deaths-retractions-critics-politicizing/,NewsAPI Auto,
5a1029ec2177,2026-06-17,"Jun 17, 2026","Whoopi Goldberg calls to 'change the regime' during Iran discussion on 'The View,' clarifies she meant Trump",Fox News,National,Original story referenced in the retraction (see full article),"Whoopi Goldberg called to ""change the regime"" on ""The View"" during a discussion about Iran but had to clarify she meant the U.S. administration, not the Iranian one.",https://www.foxnews.com/media/co-hosts-clarify-whoopi-goldberg-called-change-regime-running-america-not-iran,NewsAPI Auto,
